{
  "$id": "https://cmdrvl.com/schemas/canon.geo.composition.v0.schema.json",
  "$schema": "https://json-schema.org/draft/2020-12/schema",
  "title": "canon.geo.composition.v0",
  "type": "object",
  "additionalProperties": false,
  "properties": {
    "version": {
      "const": "canon_geo_composition.v0",
      "type": "string"
    },
    "request_version": {
      "type": "string"
    },
    "profile": {
      "$ref": "#/$defs/composition_profile"
    },
    "evidence_compilation": {
      "$ref": "#/$defs/evidence_compilation_reference"
    },
    "status": {
      "$ref": "#/$defs/composition_status"
    },
    "summary": {
      "$ref": "#/$defs/composition_summary"
    },
    "hard_forced": {
      "$ref": "#/$defs/composition_backbone"
    },
    "backbone_complete": {
      "type": "boolean"
    },
    "factorization": {
      "type": "array",
      "items": { "$ref": "#/$defs/component_summary" }
    },
    "residual_models": {
      "type": "array",
      "items": {
        "$ref": "#/$defs/composition_model"
      }
    },
    "soft_ranked": {
      "type": "array",
      "items": {
        "$ref": "#/$defs/soft_ranked_model"
      }
    },
    "conflict_constraint_ids": {
      "type": "array",
      "items": {
        "type": "string"
      }
    },
    "conflict_core_complete": {
      "type": "boolean"
    },
    "budget_fallback": {
      "oneOf": [
        {
          "$ref": "#/$defs/composition_fallback"
        },
        {
          "type": "null"
        }
      ]
    },
    "entity_projection": {
      "oneOf": [
        {
          "$ref": "#/$defs/entity_projection"
        },
        {
          "type": "null"
        }
      ]
    }
  },
  "required": [
    "version",
    "request_version",
    "profile",
    "status",
    "summary",
    "hard_forced",
    "backbone_complete",
    "factorization",
    "residual_models",
    "soft_ranked"
  ],
  "$defs": {
    "entity_level": {
      "type": "string",
      "enum": ["poi_unit", "building", "parcel", "property"]
    },
    "entity_ref": {
      "type": "object",
      "additionalProperties": false,
      "properties": {
        "level": { "$ref": "#/$defs/entity_level" },
        "id": { "type": "string" }
      },
      "required": ["level", "id"]
    },
    "composition_profile": {
      "type": "object",
      "additionalProperties": false,
      "properties": {
        "version": {
          "const": "canon_geo_composition_profile.v0",
          "type": "string"
        },
        "selection_level": {
          "$ref": "#/$defs/entity_level"
        }
      },
      "required": ["version", "selection_level"]
    },
    "evidence_compilation_reference": {
      "type": "object",
      "additionalProperties": false,
      "properties": {
        "version": {
          "const": "canon_geo_evidence_compilation.v0",
          "type": "string"
        },
        "request_version": {
          "const": "canon_geo_evidence_request.v0",
          "type": "string"
        },
        "blake3": {
          "type": "string",
          "pattern": "^[0-9a-f]{64}$"
        }
      },
      "required": [
        "version",
        "request_version",
        "blake3"
      ]
    },
    "composition_status": {
      "type": "string",
      "enum": [
        "resolved",
        "ambiguous",
        "conflict",
        "budget_fallback"
      ]
    },
    "component_summary": {
      "type": "object",
      "additionalProperties": false,
      "properties": {
        "key": { "type": "string" },
        "variables": {
          "type": "array",
          "items": { "$ref": "#/$defs/entity_ref" }
        },
        "constraint_ids": {
          "type": "array",
          "items": { "type": "string" }
        },
        "strategy": {
          "type": "string",
          "enum": [
            "any_of_inclusion_exclusion",
            "exhaustive_enumeration",
            "pruned_depth_first",
            "budget_fallback"
          ]
        },
        "exact": { "type": "boolean" },
        "search_visits": { "type": "integer", "minimum": 0 },
        "hard_feasible_assignments": { "type": "integer", "minimum": 0 },
        "hard_feasible_assignments_saturated": { "type": "boolean" },
        "positive_assignments": { "type": "integer", "minimum": 0 },
        "positive_assignments_saturated": { "type": "boolean" }
      },
      "required": [
        "key",
        "variables",
        "constraint_ids",
        "strategy",
        "exact",
        "search_visits",
        "hard_feasible_assignments_saturated",
        "positive_assignments_saturated"
      ]
    },
    "composition_model": {
      "type": "object",
      "additionalProperties": false,
      "properties": {
        "parcels": {
          "type": "array",
          "items": {
            "type": "string"
          }
        },
        "buildings": {
          "type": "array",
          "items": {
            "type": "string"
          }
        }
      },
      "required": [
        "parcels",
        "buildings"
      ]
    },
    "composition_backbone": {
      "type": "object",
      "additionalProperties": false,
      "properties": {
        "parcels": {
          "type": "array",
          "items": {
            "type": "string"
          }
        },
        "buildings": {
          "type": "array",
          "items": {
            "type": "string"
          }
        }
      },
      "required": [
        "parcels",
        "buildings"
      ]
    },
    "projected_entity_level": {
      "type": "string",
      "enum": ["building", "parcel", "site", "address"]
    },
    "entity_projection_status": {
      "type": "string",
      "enum": [
        "exact_residual",
        "count_lower_bound",
        "conflict",
        "budget_fallback",
        "suppressed",
        "unsupported"
      ]
    },
    "entity_level_projection": {
      "type": "object",
      "additionalProperties": false,
      "properties": {
        "level": { "$ref": "#/$defs/projected_entity_level" },
        "status": { "$ref": "#/$defs/entity_projection_status" },
        "candidates": {
          "type": "array",
          "items": { "type": "string" }
        },
        "hard_forced": {
          "type": "array",
          "items": { "type": "string" }
        },
        "backbone_complete": {
          "type": "boolean"
        },
        "residual_status": {
          "$ref": "#/$defs/composition_status"
        },
        "residual_model_count": {
          "type": "integer",
          "minimum": 0
        },
        "residual_model_count_complete": {
          "type": "boolean"
        },
        "residual_model_count_saturated": {
          "type": "boolean"
        },
        "residual_models_materialized": {
          "type": "boolean"
        },
        "residual_sets": {
          "type": "array",
          "items": {
            "type": "array",
            "items": { "type": "string" }
          }
        },
        "reason": {
          "type": "string"
        }
      },
      "required": [
        "level",
        "status",
        "candidates",
        "hard_forced",
        "backbone_complete",
        "residual_model_count_complete",
        "residual_model_count_saturated",
        "residual_models_materialized",
        "residual_sets",
        "reason"
      ]
    },
    "entity_projection": {
      "type": "object",
      "additionalProperties": false,
      "properties": {
        "version": {
          "const": "canon_geo_entity_projection.v0",
          "type": "string"
        },
        "profile": {
          "$ref": "#/$defs/composition_profile"
        },
        "exactness_basis": {
          "const": "exact_relative_to_declared_candidate_universe_and_quantized_representations",
          "type": "string"
        },
        "levels": {
          "type": "array",
          "items": {
            "$ref": "#/$defs/entity_level_projection"
          }
        }
      },
      "required": [
        "version",
        "profile",
        "exactness_basis",
        "levels"
      ]
    },
    "soft_ranked_model": {
      "type": "object",
      "additionalProperties": false,
      "properties": {
        "rank": {
          "type": "integer",
          "minimum": 0
        },
        "cost": {
          "type": "integer",
          "minimum": 0
        },
        "model": {
          "$ref": "#/$defs/composition_model"
        }
      },
      "required": [
        "rank",
        "cost",
        "model"
      ]
    },
    "composition_fallback": {
      "type": "object",
      "additionalProperties": false,
      "properties": {
        "component_keys": {
          "type": "array",
          "items": {
            "type": "string"
          }
        },
        "max_component_variables": {
          "type": "integer",
          "minimum": 0
        },
        "configured_max_assignments": {
          "type": "integer",
          "minimum": 1
        },
        "guidance": {
          "type": "string"
        }
      },
      "required": [
        "component_keys",
        "max_component_variables",
        "configured_max_assignments",
        "guidance"
      ]
    },
    "composition_summary": {
      "type": "object",
      "additionalProperties": false,
      "properties": {
        "parcel_candidates": {
          "type": "integer",
          "minimum": 0
        },
        "building_candidates": {
          "type": "integer",
          "minimum": 0
        },
        "candidate_assignments": {
          "type": "integer",
          "minimum": 0
        },
        "candidate_assignments_saturated": {
          "type": "boolean"
        },
        "structurally_feasible_assignments": {
          "type": "integer",
          "minimum": 0
        },
        "structurally_feasible_assignments_complete": {
          "type": "boolean"
        },
        "structurally_feasible_assignments_saturated": {
          "type": "boolean"
        },
        "hard_constraint_evaluations": {
          "type": "integer",
          "minimum": 0
        },
        "hard_constraint_evaluations_complete": {
          "type": "boolean"
        },
        "hard_constraint_evaluations_saturated": {
          "type": "boolean"
        },
        "residual_model_count": {
          "type": "integer",
          "minimum": 0
        },
        "model_count_scope": {
          "const": "entity_selection",
          "type": "string"
        },
        "residual_model_count_complete": {
          "type": "boolean"
        },
        "residual_model_count_saturated": {
          "type": "boolean"
        },
        "summary_counts_saturated": {
          "type": "boolean"
        },
        "component_count": {
          "type": "integer",
          "minimum": 0
        },
        "residual_models_materialized": {
          "type": "boolean"
        }
      },
      "required": [
        "parcel_candidates",
        "building_candidates",
        "candidate_assignments",
        "candidate_assignments_saturated",
        "structurally_feasible_assignments",
        "structurally_feasible_assignments_complete",
        "structurally_feasible_assignments_saturated",
        "hard_constraint_evaluations",
        "hard_constraint_evaluations_complete",
        "hard_constraint_evaluations_saturated",
        "residual_model_count",
        "model_count_scope",
        "residual_model_count_complete",
        "residual_model_count_saturated",
        "summary_counts_saturated",
        "component_count",
        "residual_models_materialized"
      ]
    }
  }
}
