{"version":"canon_geo_composition.v0","request_version":"canon_geo_composition_request.v0","profile":{"version":"canon_geo_composition_profile.v0","selection_level":"parcel"},"status":"ambiguous","summary":{"parcel_candidates":27,"building_candidates":0,"candidate_assignments":134217728,"candidate_assignments_saturated":false,"structurally_feasible_assignments":134217727,"structurally_feasible_assignments_complete":true,"structurally_feasible_assignments_saturated":false,"hard_constraint_evaluations":0,"hard_constraint_evaluations_complete":true,"hard_constraint_evaluations_saturated":false,"residual_model_count":134217727,"model_count_scope":"entity_selection","residual_model_count_complete":true,"residual_model_count_saturated":false,"summary_counts_saturated":false,"component_count":27,"residual_models_materialized":false},"hard_forced":{"parcels":[],"buildings":[]},"backbone_complete":true,"factorization":[{"key":"parcel:1004690013","variables":[{"level":"parcel","id":"1004690013"}],"constraint_ids":[],"strategy":"exhaustive_enumeration","exact":true,"search_visits":2,"hard_feasible_assignments":2,"hard_feasible_assignments_saturated":false,"positive_assignments":1,"positive_assignments_saturated":false},{"key":"parcel:1004690014","variables":[{"level":"parcel","id":"1004690014"}],"constraint_ids":[],"strategy":"exhaustive_enumeration","exact":true,"search_visits":2,"hard_feasible_assignments":2,"hard_feasible_assignments_saturated":false,"positive_assignments":1,"positive_assignments_saturated":false},{"key":"parcel:1004690017","variables":[{"level":"parcel","id":"1004690017"}],"constraint_ids":[],"strategy":"exhaustive_enumeration","exact":true,"search_visits":2,"hard_feasible_assignments":2,"hard_feasible_assignments_saturated":false,"positive_assignments":1,"positive_assignments_saturated":false},{"key":"parcel:1004690019","variables":[{"level":"parcel","id":"1004690019"}],"constraint_ids":[],"strategy":"exhaustive_enumeration","exact":true,"search_visits":2,"hard_feasible_assignments":2,"hard_feasible_assignments_saturated":false,"positive_assignments":1,"positive_assignments_saturated":false},{"key":"parcel:1004690021","variables":[{"level":"parcel","id":"1004690021"}],"constraint_ids":[],"strategy":"exhaustive_enumeration","exact":true,"search_visits":2,"hard_feasible_assignments":2,"hard_feasible_assignments_saturated":false,"positive_assignments":1,"positive_assignments_saturated":false},{"key":"parcel:1004690023","variables":[{"level":"parcel","id":"1004690023"}],"constraint_ids":[],"strategy":"exhaustive_enumeration","exact":true,"search_visits":2,"hard_feasible_assignments":2,"hard_feasible_assignments_saturated":false,"positive_assignments":1,"positive_assignments_saturated":false},{"key":"parcel:1004690025","variables":[{"level":"parcel","id":"1004690025"}],"constraint_ids":[],"strategy":"exhaustive_enumeration","exact":true,"search_visits":2,"hard_feasible_assignments":2,"hard_feasible_assignments_saturated":false,"positive_assignments":1,"positive_assignments_saturated":false},{"key":"parcel:1004690027","variables":[{"level":"parcel","id":"1004690027"}],"constraint_ids":[],"strategy":"exhaustive_enumeration","exact":true,"search_visits":2,"hard_feasible_assignments":2,"hard_feasible_assignments_saturated":false,"positive_assignments":1,"positive_assignments_saturated":false},{"key":"parcel:1004690030","variables":[{"level":"parcel","id":"1004690030"}],"constraint_ids":[],"strategy":"exhaustive_enumeration","exact":true,"search_visits":2,"hard_feasible_assignments":2,"hard_feasible_assignments_saturated":false,"positive_assignments":1,"positive_assignments_saturated":false},{"key":"parcel:1004690033","variables":[{"level":"parcel","id":"1004690033"}],"constraint_ids":[],"strategy":"exhaustive_enumeration","exact":true,"search_visits":2,"hard_feasible_assignments":2,"hard_feasible_assignments_saturated":false,"positive_assignments":1,"positive_assignments_saturated":false},{"key":"parcel:1004690034","variables":[{"level":"parcel","id":"1004690034"}],"constraint_ids":[],"strategy":"exhaustive_enumeration","exact":true,"search_visits":2,"hard_feasible_assignments":2,"hard_feasible_assignments_saturated":false,"positive_assignments":1,"positive_assignments_saturated":false},{"key":"parcel:1004690036","variables":[{"level":"parcel","id":"1004690036"}],"constraint_ids":[],"strategy":"exhaustive_enumeration","exact":true,"search_visits":2,"hard_feasible_assignments":2,"hard_feasible_assignments_saturated":false,"positive_assignments":1,"positive_assignments_saturated":false},{"key":"parcel:1004690037","variables":[{"level":"parcel","id":"1004690037"}],"constraint_ids":[],"strategy":"exhaustive_enumeration","exact":true,"search_visits":2,"hard_feasible_assignments":2,"hard_feasible_assignments_saturated":false,"positive_assignments":1,"positive_assignments_saturated":false},{"key":"parcel:1004690039","variables":[{"level":"parcel","id":"1004690039"}],"constraint_ids":[],"strategy":"exhaustive_enumeration","exact":true,"search_visits":2,"hard_feasible_assignments":2,"hard_feasible_assignments_saturated":false,"positive_assignments":1,"positive_assignments_saturated":false},{"key":"parcel:1004690040","variables":[{"level":"parcel","id":"1004690040"}],"constraint_ids":[],"strategy":"exhaustive_enumeration","exact":true,"search_visits":2,"hard_feasible_assignments":2,"hard_feasible_assignments_saturated":false,"positive_assignments":1,"positive_assignments_saturated":false},{"key":"parcel:1004690042","variables":[{"level":"parcel","id":"1004690042"}],"constraint_ids":[],"strategy":"exhaustive_enumeration","exact":true,"search_visits":2,"hard_feasible_assignments":2,"hard_feasible_assignments_saturated":false,"positive_assignments":1,"positive_assignments_saturated":false},{"key":"parcel:1004690043","variables":[{"level":"parcel","id":"1004690043"}],"constraint_ids":[],"strategy":"exhaustive_enumeration","exact":true,"search_visits":2,"hard_feasible_assignments":2,"hard_feasible_assignments_saturated":false,"positive_assignments":1,"positive_assignments_saturated":false},{"key":"parcel:1004690044","variables":[{"level":"parcel","id":"1004690044"}],"constraint_ids":[],"strategy":"exhaustive_enumeration","exact":true,"search_visits":2,"hard_feasible_assignments":2,"hard_feasible_assignments_saturated":false,"positive_assignments":1,"positive_assignments_saturated":false},{"key":"parcel:1004690046","variables":[{"level":"parcel","id":"1004690046"}],"constraint_ids":[],"strategy":"exhaustive_enumeration","exact":true,"search_visits":2,"hard_feasible_assignments":2,"hard_feasible_assignments_saturated":false,"positive_assignments":1,"positive_assignments_saturated":false},{"key":"parcel:1004690047","variables":[{"level":"parcel","id":"1004690047"}],"constraint_ids":[],"strategy":"exhaustive_enumeration","exact":true,"search_visits":2,"hard_feasible_assignments":2,"hard_feasible_assignments_saturated":false,"positive_assignments":1,"positive_assignments_saturated":false},{"key":"parcel:1004690049","variables":[{"level":"parcel","id":"1004690049"}],"constraint_ids":[],"strategy":"exhaustive_enumeration","exact":true,"search_visits":2,"hard_feasible_assignments":2,"hard_feasible_assignments_saturated":false,"positive_assignments":1,"positive_assignments_saturated":false},{"key":"parcel:1004697501","variables":[{"level":"parcel","id":"1004697501"}],"constraint_ids":[],"strategy":"exhaustive_enumeration","exact":true,"search_visits":2,"hard_feasible_assignments":2,"hard_feasible_assignments_saturated":false,"positive_assignments":1,"positive_assignments_saturated":false},{"key":"parcel:1004697502","variables":[{"level":"parcel","id":"1004697502"}],"constraint_ids":[],"strategy":"exhaustive_enumeration","exact":true,"search_visits":2,"hard_feasible_assignments":2,"hard_feasible_assignments_saturated":false,"positive_assignments":1,"positive_assignments_saturated":false},{"key":"parcel:1004697503","variables":[{"level":"parcel","id":"1004697503"}],"constraint_ids":[],"strategy":"exhaustive_enumeration","exact":true,"search_visits":2,"hard_feasible_assignments":2,"hard_feasible_assignments_saturated":false,"positive_assignments":1,"positive_assignments_saturated":false},{"key":"parcel:1004697504","variables":[{"level":"parcel","id":"1004697504"}],"constraint_ids":[],"strategy":"exhaustive_enumeration","exact":true,"search_visits":2,"hard_feasible_assignments":2,"hard_feasible_assignments_saturated":false,"positive_assignments":1,"positive_assignments_saturated":false},{"key":"parcel:1004697505","variables":[{"level":"parcel","id":"1004697505"}],"constraint_ids":[],"strategy":"exhaustive_enumeration","exact":true,"search_visits":2,"hard_feasible_assignments":2,"hard_feasible_assignments_saturated":false,"positive_assignments":1,"positive_assignments_saturated":false},{"key":"parcel:1004697506","variables":[{"level":"parcel","id":"1004697506"}],"constraint_ids":[],"strategy":"exhaustive_enumeration","exact":true,"search_visits":2,"hard_feasible_assignments":2,"hard_feasible_assignments_saturated":false,"positive_assignments":1,"positive_assignments_saturated":false}],"residual_models":[],"soft_ranked":[]}