{"version":"canon_geo_composition.v0","request_version":"canon_geo_composition_request.v0","profile":{"version":"canon_geo_composition_profile.v0","selection_level":"parcel"},"status":"ambiguous","summary":{"parcel_candidates":20,"building_candidates":0,"candidate_assignments":1048576,"candidate_assignments_saturated":false,"structurally_feasible_assignments":1048575,"structurally_feasible_assignments_complete":true,"structurally_feasible_assignments_saturated":false,"hard_constraint_evaluations":2,"hard_constraint_evaluations_complete":true,"hard_constraint_evaluations_saturated":false,"residual_model_count":786432,"model_count_scope":"entity_selection","residual_model_count_complete":true,"residual_model_count_saturated":false,"summary_counts_saturated":false,"component_count":19,"residual_models_materialized":false},"hard_forced":{"parcels":[],"buildings":[]},"backbone_complete":true,"factorization":[{"key":"parcel:3025570001","variables":[{"level":"parcel","id":"3025570001"}],"constraint_ids":[],"strategy":"any_of_inclusion_exclusion","exact":true,"search_visits":0,"hard_feasible_assignments_saturated":false,"positive_assignments_saturated":false},{"key":"parcel:3025570003","variables":[{"level":"parcel","id":"3025570003"}],"constraint_ids":[],"strategy":"any_of_inclusion_exclusion","exact":true,"search_visits":0,"hard_feasible_assignments_saturated":false,"positive_assignments_saturated":false},{"key":"parcel:3025570007","variables":[{"level":"parcel","id":"3025570007"}],"constraint_ids":[],"strategy":"any_of_inclusion_exclusion","exact":true,"search_visits":0,"hard_feasible_assignments_saturated":false,"positive_assignments_saturated":false},{"key":"parcel:3025570013","variables":[{"level":"parcel","id":"3025570013"},{"level":"parcel","id":"4000560036"}],"constraint_ids":["rho:rho.address.pad.membership@1.0.0:obs.address.pad.membership:h7-subject:round-exact-lender:6506716451b8405fbd83f48449d4f858881f94bc3b8a7ea3001e7b5399a3a018"],"strategy":"any_of_inclusion_exclusion","exact":true,"search_visits":0,"hard_feasible_assignments_saturated":false,"positive_assignments_saturated":false},{"key":"parcel:3025570016","variables":[{"level":"parcel","id":"3025570016"}],"constraint_ids":[],"strategy":"any_of_inclusion_exclusion","exact":true,"search_visits":0,"hard_feasible_assignments_saturated":false,"positive_assignments_saturated":false},{"key":"parcel:3025570024","variables":[{"level":"parcel","id":"3025570024"}],"constraint_ids":[],"strategy":"any_of_inclusion_exclusion","exact":true,"search_visits":0,"hard_feasible_assignments_saturated":false,"positive_assignments_saturated":false},{"key":"parcel:4000560006","variables":[{"level":"parcel","id":"4000560006"}],"constraint_ids":[],"strategy":"any_of_inclusion_exclusion","exact":true,"search_visits":0,"hard_feasible_assignments_saturated":false,"positive_assignments_saturated":false},{"key":"parcel:4000560010","variables":[{"level":"parcel","id":"4000560010"}],"constraint_ids":[],"strategy":"any_of_inclusion_exclusion","exact":true,"search_visits":0,"hard_feasible_assignments_saturated":false,"positive_assignments_saturated":false},{"key":"parcel:4000560012","variables":[{"level":"parcel","id":"4000560012"}],"constraint_ids":[],"strategy":"any_of_inclusion_exclusion","exact":true,"search_visits":0,"hard_feasible_assignments_saturated":false,"positive_assignments_saturated":false},{"key":"parcel:4000560013","variables":[{"level":"parcel","id":"4000560013"}],"constraint_ids":[],"strategy":"any_of_inclusion_exclusion","exact":true,"search_visits":0,"hard_feasible_assignments_saturated":false,"positive_assignments_saturated":false},{"key":"parcel:4000560018","variables":[{"level":"parcel","id":"4000560018"}],"constraint_ids":[],"strategy":"any_of_inclusion_exclusion","exact":true,"search_visits":0,"hard_feasible_assignments_saturated":false,"positive_assignments_saturated":false},{"key":"parcel:4000560035","variables":[{"level":"parcel","id":"4000560035"}],"constraint_ids":[],"strategy":"any_of_inclusion_exclusion","exact":true,"search_visits":0,"hard_feasible_assignments_saturated":false,"positive_assignments_saturated":false},{"key":"parcel:4000560040","variables":[{"level":"parcel","id":"4000560040"}],"constraint_ids":[],"strategy":"any_of_inclusion_exclusion","exact":true,"search_visits":0,"hard_feasible_assignments_saturated":false,"positive_assignments_saturated":false},{"key":"parcel:4000560043","variables":[{"level":"parcel","id":"4000560043"}],"constraint_ids":[],"strategy":"any_of_inclusion_exclusion","exact":true,"search_visits":0,"hard_feasible_assignments_saturated":false,"positive_assignments_saturated":false},{"key":"parcel:4000560047","variables":[{"level":"parcel","id":"4000560047"}],"constraint_ids":[],"strategy":"any_of_inclusion_exclusion","exact":true,"search_visits":0,"hard_feasible_assignments_saturated":false,"positive_assignments_saturated":false},{"key":"parcel:4000560049","variables":[{"level":"parcel","id":"4000560049"}],"constraint_ids":[],"strategy":"any_of_inclusion_exclusion","exact":true,"search_visits":0,"hard_feasible_assignments_saturated":false,"positive_assignments_saturated":false},{"key":"parcel:4000567501","variables":[{"level":"parcel","id":"4000567501"}],"constraint_ids":[],"strategy":"any_of_inclusion_exclusion","exact":true,"search_visits":0,"hard_feasible_assignments_saturated":false,"positive_assignments_saturated":false},{"key":"parcel:4000567502","variables":[{"level":"parcel","id":"4000567502"}],"constraint_ids":[],"strategy":"any_of_inclusion_exclusion","exact":true,"search_visits":0,"hard_feasible_assignments_saturated":false,"positive_assignments_saturated":false},{"key":"parcel:4000567503","variables":[{"level":"parcel","id":"4000567503"}],"constraint_ids":[],"strategy":"any_of_inclusion_exclusion","exact":true,"search_visits":0,"hard_feasible_assignments_saturated":false,"positive_assignments_saturated":false}],"residual_models":[],"soft_ranked":[]}