{"version":"canon_geo_composition.v0","request_version":"canon_geo_composition_request.v0","profile":{"version":"canon_geo_composition_profile.v0","selection_level":"parcel"},"status":"resolved","summary":{"parcel_candidates":1,"building_candidates":0,"candidate_assignments":2,"candidate_assignments_saturated":false,"structurally_feasible_assignments":1,"structurally_feasible_assignments_complete":true,"structurally_feasible_assignments_saturated":false,"hard_constraint_evaluations":0,"hard_constraint_evaluations_complete":true,"hard_constraint_evaluations_saturated":false,"residual_model_count":1,"model_count_scope":"entity_selection","residual_model_count_complete":true,"residual_model_count_saturated":false,"summary_counts_saturated":false,"component_count":1,"residual_models_materialized":true},"hard_forced":{"parcels":["1006397501"],"buildings":[]},"backbone_complete":true,"factorization":[{"key":"parcel:1006397501","variables":[{"level":"parcel","id":"1006397501"}],"constraint_ids":[],"strategy":"exhaustive_enumeration","exact":true,"search_visits":2,"hard_feasible_assignments":2,"hard_feasible_assignments_saturated":false,"positive_assignments":1,"positive_assignments_saturated":false}],"residual_models":[{"parcels":["1006397501"],"buildings":[]}],"soft_ranked":[{"rank":1,"cost":0,"model":{"parcels":["1006397501"],"buildings":[]}}]}